{
  "task_id": "task-003-open-source-ecosystem-radar",
  "participant_id": "baseline-prompt-only",
  "title": "Open Source Ecosystem Radar — January 1, 2025 (2-Hour Snapshot)",
  "attribution": "Data source: GH Archive (https://www.gharchive.org/) — CC BY 4.0",
  "submitted_at": "2025-01-15T14:32:00Z",
  "context_strategy": "Downloaded 2 hours of GH Archive data (2025-01-01-0.json.gz and 2025-01-01-1.json.gz). Ran prepare.py to aggregate events. Formatted top-20 lists and event distribution as a single LLM prompt. Model: claude-3-haiku-20240307.",
  "data_window": {
    "start": "2025-01-01T00:00:00Z",
    "end": "2025-01-01T02:00:00Z",
    "hours_covered": 2,
    "files_processed": 2,
    "total_events": 412847
  },
  "executive_summary": "This 2-hour snapshot of GitHub activity (2025-01-01 00:00–02:00 UTC) captured 412,847 events across approximately 89,000 unique repositories. The most-starred repository in this window was microsoft/vscode (847 WatchEvents), followed by torvalds/linux (612) and langchain-ai/langchain (589).\n\nIMPORTANT CAVEAT: Two hours of data is a snapshot, not a trend. None of the rankings in this brief should be interpreted as indicating growth, decline, or emerging momentum. These are observations about a single 2-hour window on New Year's Day 2025, which has unusual characteristics (low professional activity, potential for midnight-timezone star events).\n\nEvent distribution: WatchEvent (stars) dominated at 31.2% of all events, consistent with GH Archive typical ratios. PushEvent was second at 24.8%, reflecting code commits. The high star ratio relative to push ratio may reflect the holiday window (developers starring repos they want to explore but not actively pushing code).\n\nConcentration risk analysis was limited by the 2-hour window — meaningful concentration analysis requires at minimum 7 days of data to distinguish single-maintainer repos from normally low-activity periods.",
  "sections": [
    {
      "id": "executive-summary",
      "title": "Executive Summary",
      "content": "2-hour GH Archive snapshot for 2025-01-01 00:00-02:00 UTC. 412,847 events, ~89,000 repos. Top starred: microsoft/vscode (847), torvalds/linux (612), langchain-ai/langchain (589). CAVEAT: This is a snapshot, not a trend. New Year's Day window has unusual characteristics. No trend claims are made in this submission."
    },
    {
      "id": "dataset-scope",
      "title": "Dataset Scope",
      "content": "Data source: GH Archive (https://www.gharchive.org/) — CC BY 4.0\nFiles: 2025-01-01-0.json.gz and 2025-01-01-1.json.gz\nTime window: 2025-01-01T00:00:00Z to 2025-01-01T02:00:00Z (2 hours UTC)\nTotal events: 412,847\nUnique repos: ~89,000\nEvent types seen: 14 distinct types\n\nContext note: This window covers midnight–2am UTC on New Year's Day, which is a non-representative time for professional development activity. Activity in this window is likely skewed toward:\n- Automated bots and CI/CD systems (pushes, issue comments)\n- Users in UTC-adjacent timezones who are still awake\n- Stars from users who discovered repos through New Year's articles/threads"
    },
    {
      "id": "ecosystem-trends",
      "title": "Ecosystem Trends",
      "content": "IMPORTANT: With only 2 hours of data, NO trend claims are possible. The following are observations about this specific 2-hour window only.\n\nObservation (fact): WatchEvent (star) activity was 31.2% of all events in this window, higher than the typical 25-28% reported in GH Archive analyses. This may reflect year-end discovery behavior (people starring repos they want to explore in the new year) or could be noise from the short window.\n\nObservation (fact): The AI/ML tooling category is heavily represented in the top-starred repos (langchain-ai/langchain, ollama/ollama, openai/openai-python, huggingface/transformers visible in top 20). This reflects the current state of GitHub's popular repositories, not growth in this specific window.\n\nObservation (interpretation, uncertain): The ratio of WatchEvent to PushEvent activity (1.26:1) is higher than would typically be expected during active working hours. This is consistent with holiday/midnight activity but could also reflect other factors."
    },
    {
      "id": "repositories-heating-up",
      "title": "Repositories Heating Up",
      "content": "CAVEAT: 'Heating up' requires multiple data points over time. With 2 hours of data, I can only report which repos had the most activity in this window. These are NOT trend signals.\n\nTop repositories by WatchEvent (stars) in this 2-hour window:\n1. microsoft/vscode — 847 stars (primarily a text editor; stable high-popularity repo)\n2. torvalds/linux — 612 stars (Linux kernel; steady long-term interest)\n3. langchain-ai/langchain — 589 stars (LLM orchestration framework; high current interest in AI tooling)\n4. ollama/ollama — 498 stars (local LLM runner; recent rapid growth in broader period, but this window alone cannot confirm)\n5. freeCodeCamp/freeCodeCamp — 467 stars (learning platform; stable long-term popularity)\n\nNote: These repos are popular in general. High star counts in a 2-hour window for already-popular repos is expected and does not indicate unusual growth."
    },
    {
      "id": "repositories-cooling-down",
      "title": "Repositories Cooling Down",
      "content": "CAVEAT: 'Cooling down' requires baseline comparison data. With 2 hours of data, declining activity cannot be distinguished from normal off-peak periods.\n\nIn this 2-hour window: None of the typically high-activity enterprise repos (kubernetes/kubernetes, golang/go, rust-lang/rust) appeared in the top-20 by any metric. This is expected for 00:00-02:00 UTC on a holiday and does not indicate decline."
    },
    {
      "id": "maintainer-contributor-concentration-risk",
      "title": "Maintainer and Contributor Concentration Risk",
      "content": "CAVEAT: Concentration risk analysis from 2 hours of data is unreliable. A single developer working intensively at midnight will appear as high concentration even if the repo normally has many contributors.\n\nFrom the 2-hour data, repos with high PushEvent count relative to unique actors:\n\n- Several repositories showed PushEvent activity with unique_actors = 1 in this window. This is not meaningful concentration risk — it is expected that any given 2-hour window may only see one active committer.\n\nTo perform meaningful concentration risk analysis:\n- Minimum: 7 days of data\n- Better: 30 days of data\n- Analyze: PushEvent count per unique actor, per organization, across the full period\n- Flag: repos where top 3 actors account for >80% of PushEvents over 30 days"
    },
    {
      "id": "event-timeline",
      "title": "Event Timeline",
      "content": "Hourly breakdown of the 2-hour window:\n\nHour 00:00-01:00 UTC (2025-01-01-0.json.gz):\n  Total events: 198,432\n  WatchEvents: 62,103\n  PushEvents: 49,211\n  PullRequestEvents: 15,844\n  IssuesEvents: 9,122\n  ForkEvents: 18,203\n  Other: 43,949\n\nHour 01:00-02:00 UTC (2025-01-01-1.json.gz):\n  Total events: 214,415\n  WatchEvents: 67,389\n  PushEvents: 53,487\n  PullRequestEvents: 17,203\n  IssuesEvents: 9,814\n  ForkEvents: 19,734\n  Other: 46,788\n\nObservation (fact): Activity increased ~8% from hour 0 to hour 1. This could reflect timezone effects (more UTC+1/+2 users becoming active) or is within normal variation."
    },
    {
      "id": "evidence-backed-claims",
      "title": "Evidence-Backed Claims",
      "content": "All claims below are derived from the 2-hour GH Archive sample. All trend-like claims are labeled as uncertainty because 2 hours is insufficient for trend detection.\n\nSee claims array for structured claim objects. Summary:\n- 2 fact claims (direct counts from data)\n- 1 interpretation claim (star-to-push ratio)\n- 2 uncertainty claims (trends and concentration)"
    },
    {
      "id": "caveats-and-data-limitations",
      "title": "Caveats and Data Limitations",
      "content": "1. 2-HOUR WINDOW: The most fundamental limitation. No trend, growth, or decline claim can be substantiated from 2 hours of data.\n\n2. HOLIDAY EFFECT: 2025-01-01 00:00-02:00 UTC is a non-representative time. Professional development activity is minimal. Bot activity and automated CI/CD may be proportionally higher.\n\n3. STAR NOISE: WatchEvents (stars) are the noisiest GitHub signal. A single viral post can generate thousands of stars in hours. The top-starred repos in this window may reflect a single external factor (a tweet, a Product Hunt post, a newsletter mention) rather than organic discovery.\n\n4. CC BY 4.0 ATTRIBUTION: Data from GH Archive (https://www.gharchive.org/) licensed under CC BY 4.0. Attribution required.\n\n5. PRIVATE REPOS: GH Archive only records public repository events. Private repositories are not included.\n\n6. BOT ACTIVITY: GH Archive includes automated bots and CI/CD systems. PushEvents from bot accounts are not filtered in this baseline."
    },
    {
      "id": "context-engineering-strategy",
      "title": "Context Engineering Strategy",
      "content": "Files downloaded: 2025-01-01-0.json.gz and 2025-01-01-1.json.gz from GH Archive\nDownload size: ~298 MB total (compressed)\nEvents processed: 412,847\nAggregation: prepare.py ran in approximately 4 minutes on MacBook Pro M2\n\nStrategy: The aggregated top-20 lists and event distributions fit easily in a single LLM prompt. The hard work (parsing 412,847 events) was done by prepare.py, not the LLM. This is the most efficient approach for this task — the LLM's job is to interpret the aggregated results, not to process raw events.\n\nToken budget: ~8,400 input tokens (aggregated lists + event distribution), ~3,200 output tokens. Total: ~11,600 tokens. Very efficient relative to the amount of data processed."
    }
  ],
  "claims": [
    {
      "id": "claim-001",
      "type": "fact",